{
    "task_id": "TASK-0001",
    "work_item_revision": 1,
    "artifact_attempt": 1,
    "entries": [
        {
            "status": "ADD",
            "path": "docs/USAGE.md",
            "changed_paths": [
                "docs/USAGE.md"
            ],
            "evidence": "新增完整中文操作手册，覆盖首次接入、提需求前检查、任务生命周期、严谨度、独立 Review、恢复、升级与故障排查。"
        },
        {
            "status": "UPDATE",
            "path": "README.md",
            "changed_paths": [
                "README.md"
            ],
            "evidence": "README 顶部新增 docs/USAGE.md 的稳定入口，保留 README 作为快速概览。"
        }
    ]
}
